{
  "$schema": "https://json-schema.org/draft/2020-12/schema",
  "$id": "https://comfy-osh.dev/schema/poses.schema.json",
  "title": "Poses",
  "description": "Camera poses recovered from a generated take (e.g. Depth Anything 3), one entry per solved frame. Same convention as Shot after conversion: right-handed, Y-up, three.js; the camera looks down its local -Z; position is the camera centre and quaternion the camera-to-world rotation. World origin is the first solved camera and scale is arbitrary, so only Sim(3)-aligned comparison is meaningful. Frames may be a subset of the clip: t is seconds from clip start and the verifier interpolates onto the Shot's frame times. Cross-field rules not expressible here (enforced by the zod and pydantic mirrors): index and t strictly increasing; quaternions unit length; frames non-empty when solve_ok is true.",
  "type": "object",
  "additionalProperties": false,
  "required": ["schema", "fps", "image", "solve_ok", "frames"],
  "properties": {
    "schema": { "const": "comfy-osh/poses/1" },
    "fps": { "description": "Frame rate of the clip the poses were recovered from.", "type": "number", "exclusiveMinimum": 0 },
    "image": {
      "description": "Pixel size the intrinsics refer to (the model's processed size, not necessarily the clip's).",
      "type": "object",
      "additionalProperties": false,
      "required": ["width", "height"],
      "properties": {
        "width": { "type": "integer", "minimum": 1 },
        "height": { "type": "integer", "minimum": 1 }
      }
    },
    "solve_ok": { "description": "False when the pose solve failed; the verifier then reports solveOk=false.", "type": "boolean" },
    "convention": { "description": "Free-form provenance of the axes and units, for humans.", "type": "object" },
    "source": { "description": "Free-form provenance of the solver (model, mode).", "type": "object" },
    "frames": {
      "type": "array",
      "items": {
        "type": "object",
        "additionalProperties": false,
        "required": ["index", "t", "position", "quaternion", "fov_v_deg"],
        "properties": {
          "index": { "description": "Frame index in the source clip.", "type": "integer", "minimum": 0 },
          "t": { "description": "Seconds from clip start.", "type": "number", "minimum": 0 },
          "position": { "$ref": "common.schema.json#/$defs/vec3" },
          "quaternion": { "$ref": "common.schema.json#/$defs/quat" },
          "fov_v_deg": { "type": "number", "exclusiveMinimum": 0, "exclusiveMaximum": 180 },
          "fx": { "type": "number", "exclusiveMinimum": 0 },
          "fy": { "type": "number", "exclusiveMinimum": 0 },
          "cx": { "type": "number" },
          "cy": { "type": "number" }
        }
      }
    }
  }
}
