{
  "schema": "comfy-osh/poses/1",
  "convention": {
    "handedness": "right",
    "up": "+Y",
    "camera_forward": "-Z",
    "quaternion": "xyzw",
    "transform": "camera-to-world",
    "units": "relative (non-metric), world = camera 0 frame"
  },
  "image": {
    "width": 448,
    "height": 252
  },
  "fps": 8.0,
  "solve_ok": true,
  "source": {
    "model": "depth-anything-3",
    "mode": "multiview"
  },
  "frames": [
    {
      "index": 0,
      "t": 0.0,
      "position": [
        -0.0007834173478883212,
        0.00022042916132958306,
        -0.0003210455071170766
      ],
      "quaternion": [
        -0.000689133261107789,
        -4.1664690002483955e-05,
        -0.0002135021465771169,
        0.9999997388880836
      ],
      "fov_v_deg": 34.81418425971499,
      "fx": 401.89215087890625,
      "fy": 401.89215087890625,
      "cx": 224.0,
      "cy": 126.0
    },
    {
      "index": 1,
      "t": 0.125,
      "position": [
        0.003799080832445155,
        -0.0015841535858216493,
        -0.014998942631697815
      ],
      "quaternion": [
        -0.0020791399661610026,
        -0.001413935541108912,
        0.0005668210799536111,
        0.9999966783330584
      ],
      "fov_v_deg": 35.29026447826531,
      "fx": 396.11944580078125,
      "fy": 396.11944580078125,
      "cx": 224.0,
      "cy": 126.0
    },
    {
      "index": 2,
      "t": 0.25,
      "position": [
        0.004408739718494283,
        -0.0015312247259667516,
        -0.049186776252092876
      ],
      "quaternion": [
        -0.001537918889576491,
        -0.005721903419953242,
        0.001826641170671351,
        0.999980778819661
      ],
      "fov_v_deg": 35.1715458579276,
      "fx": 397.5447998046875,
      "fy": 397.5447998046875,
      "cx": 224.0,
      "cy": 126.0
    },
    {
      "index": 3,
      "t": 0.375,
      "position": [
        0.012779124486026047,
        -0.00027214736481715325,
        -0.08432762705818296
      ],
      "quaternion": [
        -0.0023844801892376017,
        -0.004767828343431031,
        0.0013683553979695023,
        0.99998485472062
      ],
      "fov_v_deg": 35.173532267734004,
      "fx": 397.5208740234375,
      "fy": 397.5208740234375,
      "cx": 224.0,
      "cy": 126.0
    },
    {
      "index": 4,
      "t": 0.5,
      "position": [
        0.0162130663896594,
        0.0025600754474430954,
        -0.14050973254532123
      ],
      "quaternion": [
        -0.0027699645904879916,
        -0.002869367641550337,
        0.0029180092745757337,
        0.9999877895491418
      ],
      "fov_v_deg": 35.177685681067615,
      "fx": 397.4708557128906,
      "fy": 397.4708557128906,
      "cx": 224.0,
      "cy": 126.0
    },
    {
      "index": 5,
      "t": 0.625,
      "position": [
        0.017816357747211745,
        0.002843283192891165,
        -0.05376611642548848
      ],
      "quaternion": [
        -0.0026840752000322583,
        -0.004921453320613163,
        0.0029426870333521707,
        0.9999799576144301
      ],
      "fov_v_deg": 34.845792487446694,
      "fx": 401.504150390625,
      "fy": 401.504150390625,
      "cx": 224.0,
      "cy": 126.0
    },
    {
      "index": 6,
      "t": 0.75,
      "position": [
        0.022736433670461305,
        -0.00039554387001879094,
        -0.09753430753280866
      ],
      "quaternion": [
        -0.0019140412714186868,
        -0.00468416174088175,
        0.000676356198200928,
        0.9999869687236377
      ],
      "fov_v_deg": 35.13226772769105,
      "fx": 398.0184326171875,
      "fy": 398.0184326171875,
      "cx": 224.0,
      "cy": 126.0
    },
    {
      "index": 7,
      "t": 0.875,
      "position": [
        0.019332261092132125,
        0.003555946203926062,
        -0.17366894014240722
      ],
      "quaternion": [
        -0.004107218558531065,
        -0.005373712606461613,
        9.292884174084286e-05,
        0.9999771224046908
      ],
      "fov_v_deg": 35.26200031715578,
      "fx": 396.45794677734375,
      "fy": 396.45794677734375,
      "cx": 224.0,
      "cy": 126.0
    },
    {
      "index": 8,
      "t": 1.0,
      "position": [
        0.01952526638081916,
        0.0013872011807765712,
        -0.1266717640671388
      ],
      "quaternion": [
        -0.0030828136386460933,
        -0.0030669850377126697,
        -0.0017149194506128518,
        0.9999890743973785
      ],
      "fov_v_deg": 35.156874946464406,
      "fx": 397.7215881347656,
      "fy": 397.7215881347656,
      "cx": 224.0,
      "cy": 126.0
    },
    {
      "index": 9,
      "t": 1.125,
      "position": [
        0.018166504057972703,
        0.005889665389914605,
        -0.19362522586832528
      ],
      "quaternion": [
        -0.004329465486627185,
        -0.005364890068026143,
        0.0025706775932439674,
        0.9999729322836042
      ],
      "fov_v_deg": 35.03204702887448,
      "fx": 399.2315979003906,
      "fy": 399.2315979003906,
      "cx": 224.0,
      "cy": 126.0
    },
    {
      "index": 10,
      "t": 1.25,
      "position": [
        0.005349371214225661,
        0.004229359222588009,
        -0.13695015059522178
      ],
      "quaternion": [
        -0.0034202887743737397,
        -0.008185192365776639,
        0.0014932549507526553,
        0.9999595364014923
      ],
      "fov_v_deg": 35.02077220791886,
      "fx": 399.3684997558594,
      "fy": 399.3684997558594,
      "cx": 224.0,
      "cy": 126.0
    },
    {
      "index": 11,
      "t": 1.375,
      "position": [
        0.01671235327385306,
        0.0019552109869033114,
        -0.20597362459652008
      ],
      "quaternion": [
        -0.003906362946373171,
        -0.0005466635194145194,
        0.0016865197342012632,
        0.9999907985270233
      ],
      "fov_v_deg": 35.24591555842506,
      "fx": 396.65081787109375,
      "fy": 396.65081787109375,
      "cx": 224.0,
      "cy": 126.0
    },
    {
      "index": 12,
      "t": 1.5,
      "position": [
        0.0023402571260231772,
        0.0026173854708007025,
        -0.11961076975723378
      ],
      "quaternion": [
        -0.006803713255473015,
        -0.003348333741523779,
        0.0020857956166563324,
        0.9999690733236395
      ],
      "fov_v_deg": 35.00504545480207,
      "fx": 399.5596008300781,
      "fy": 399.5596008300781,
      "cx": 224.0,
      "cy": 126.0
    },
    {
      "index": 13,
      "t": 1.625,
      "position": [
        0.0051701813880836904,
        -0.0023297816166869055,
        -0.15403541861181183
      ],
      "quaternion": [
        -0.0022902707494663007,
        -0.0017857842224088727,
        4.3850186037939416e-05,
        0.9999957818469869
      ],
      "fov_v_deg": 35.08669843486818,
      "fx": 398.5692138671875,
      "fy": 398.5692138671875,
      "cx": 224.0,
      "cy": 126.0
    },
    {
      "index": 14,
      "t": 1.75,
      "position": [
        -0.001497361784586125,
        0.001806447169094368,
        -0.18356979190904224
      ],
      "quaternion": [
        -0.004781233879975803,
        -0.002740263417496818,
        0.003519449535288329,
        0.9999786218884663
      ],
      "fov_v_deg": 35.08902109004932,
      "fx": 398.5411071777344,
      "fy": 398.5411071777344,
      "cx": 224.0,
      "cy": 126.0
    },
    {
      "index": 15,
      "t": 1.875,
      "position": [
        -0.004287804887644553,
        0.005516579042284452,
        -0.21010331712723507
      ],
      "quaternion": [
        -0.003980580450211286,
        -0.003192570376222493,
        0.0020317867640268932,
        0.9999849170443612
      ],
      "fov_v_deg": 35.0639894397409,
      "fx": 398.8442077636719,
      "fy": 398.8442077636719,
      "cx": 224.0,
      "cy": 126.0
    },
    {
      "index": 16,
      "t": 2.0,
      "position": [
        -0.01091870263279891,
        0.0013647695117443295,
        -0.17111426299276797
      ],
      "quaternion": [
        -0.002836272480012602,
        -0.004633562294497142,
        -0.0017041692283768168,
        0.9999837906016894
      ],
      "fov_v_deg": 35.04521323229666,
      "fx": 399.07183837890625,
      "fy": 399.07183837890625,
      "cx": 224.0,
      "cy": 126.0
    }
  ]
}